{
	"run_id": "run-demo-001",
	"card_id": "demo-widget-audit",
	"node_id": "plan",
	"node_type": "agent",
	"stage": "plan",
	"harness": "claude-code",
	"model": "demo-workhorse-model",
	"tier": "workhorse",
	"status": "passed",
	"payload_ref": "/tmp/demo/run-demo-001/plan.json",
	"prompt_ref": "/tmp/demo/run-demo-001/prompt.md",
	"usage": {
		"tokens_in": 1200,
		"tokens_out": 340,
		"cost_usd": 0.012
	},
	"ts": "2026-07-17T09:05:00Z"
}
